{
  "schemaVersion": "m6.0-v1",
  "id": "si-diamond",
  "coordinateUnit": "angstrom",
  "atoms": [
    {
      "id": "a1",
      "element": "Si",
      "position": [
        0.0,
        0.0,
        0.0
      ],
      "occupancy": 1
    },
    {
      "id": "a2",
      "element": "Si",
      "position": [
        0.0,
        2.715,
        2.715
      ],
      "occupancy": 1
    },
    {
      "id": "a3",
      "element": "Si",
      "position": [
        2.715,
        0.0,
        2.715
      ],
      "occupancy": 1
    },
    {
      "id": "a4",
      "element": "Si",
      "position": [
        2.715,
        2.715,
        0.0
      ],
      "occupancy": 1
    },
    {
      "id": "a5",
      "element": "Si",
      "position": [
        1.3575,
        1.3575,
        1.3575
      ],
      "occupancy": 1
    },
    {
      "id": "a6",
      "element": "Si",
      "position": [
        1.3575,
        4.0725,
        4.0725
      ],
      "occupancy": 1
    },
    {
      "id": "a7",
      "element": "Si",
      "position": [
        4.0725,
        1.3575,
        4.0725
      ],
      "occupancy": 1
    },
    {
      "id": "a8",
      "element": "Si",
      "position": [
        4.0725,
        4.0725,
        1.3575
      ],
      "occupancy": 1
    }
  ],
  "cell": [
    [
      5.43,
      0,
      0
    ],
    [
      0,
      5.43,
      0
    ],
    [
      0,
      0,
      5.43
    ]
  ],
  "pbc": [
    true,
    true,
    true
  ],
  "charge": null,
  "spinMultiplicity": null,
  "source": {
    "artifactId": "sample-si-diamond",
    "sha256": "6e5be3cfe63c70a5567592d4ae6e207d5213ac57625faf864b57261bcce96812",
    "format": "poscar",
    "provenance": "team-synthetic",
    "license": "AGPL-3.0-only",
    "transformations": []
  },
  "issues": []
}
